[
  {
    "id": "PHY-T1001",
    "name": "Credential Technology Assessment",
    "status": "base_coverage",
    "tactic_id": "PHY-TAC-02",
    "tactic_name": "Credential & Identity Protection",
    "target_object": "BADGE",
    "target_time_seconds": 5,
    "hypothesis": "Static, unauthenticated credential identifiers may permit credential replay or cloning where the access-control architecture does not provide cryptographic mutual authentication.",
    "assessment_condition": "Does the electronic credential broadcast a static unencrypted identifier (such as 125 kHz Prox or unauthenticated CSN) without cryptographic challenge-response validation?",
    "assessment_procedure": {
      "method": "passive_rf_interrogation",
      "tools_required": [
        "Pocket dual-frequency RFID/NFC reader"
      ],
      "steps": [
        "Hold sample authorized credential in proximity to the test reader.",
        "Identify operating carrier frequency (125 kHz Low Frequency vs. 13.56 MHz High Frequency).",
        "Determine whether transmission is static unencrypted UID/CSN or mutual cryptographic protocol (ISO/IEC 14443-4 / ISO/IEC 7816)."
      ]
    },
    "evidence_requirements": {
      "data_type": "device_read",
      "acceptable_formats": [
        "RFID reader frequency & protocol log",
        "Credential model identifier"
      ],
      "validation_criteria": "Documented carrier frequency and whether credential protocol implements cryptographic challenge-response authentication."
    },
    "result_model": {
      "hardened_criteria": "Credential implements mutual cryptographic authentication (AES-128 / DESFire EV2/EV3 / Seos / PIV smartcard).",
      "deficient_criteria": "Credential relies on unencrypted 125 kHz Prox (HID Prox, EM4100) or static 13.56 MHz CSN without mutual authentication.",
      "condition_requires_validation_criteria": "High-frequency smartcard observed; reader-side SAM cryptographic validation requires administrative policy audit."
    },
    "limitations": {
      "can_establish": [
        "Operating carrier frequency (LF 125 kHz vs. HF 13.56 MHz).",
        "Presence of unencrypted static identifier broadcast."
      ],
      "cannot_establish": [
        "Whether physical badge cloning equipment is locally available.",
        "Whether secondary compensating factors (such as biometric verification or PACs duress monitoring) are enforced at readers."
      ]
    },
    "mitigation_id": "PHY-M1001",
    "mitigation_name": "Cryptographic Smartcard Migration",
    "mitigation_action": "Upgrade credential stock to ISO/IEC 14443-4 smartcards with AES-128 mutual authentication (DESFire EV3 / Seos) and activate SAM keys on access readers.",
    "technical_references": [
      {
        "standard": "ISO/IEC 14443-4",
        "section": "Transmission Protocol",
        "title": "Identification cards - Contactless integrated circuit cards"
      },
      {
        "standard": "NIST SP 800-116 Rev 1",
        "section": "Section 4.1",
        "title": "Guidelines for the Use of PIV Credentials in Facility Access"
      }
    ],
    "framework_mappings": [
      {
        "framework": "ISO/IEC 27001:2022",
        "control_id": "A.7.2",
        "title": "Physical entry controls"
      },
      {
        "framework": "PCI DSS v4.0",
        "control_id": "Req 9.2.1",
        "title": "Physical access control to sensitive areas"
      }
    ]
  },
  {
    "id": "PHY-T1002",
    "name": "Door & Latch Protection Assessment",
    "status": "base_coverage",
    "tactic_id": "PHY-TAC-03",
    "tactic_name": "Portal & Architectural Barrier Protection",
    "target_object": "DOOR",
    "target_time_seconds": 15,
    "hypothesis": "Door and frame geometry may permit mechanical manipulation of the latch bolt assembly where protective physical shielding is absent and strike clearances exceed engineering tolerances.",
    "assessment_condition": "Does the outward-opening door assembly exhibit strike margin clearance exceeding 3.2mm (1/8 in.) with direct line-of-sight to the latch bolt and zero overlapping protective steel astragal guard, where applicable standards or specifications mandate tight margins or shielding?",
    "assessment_procedure": {
      "method": "visual_and_feeler_gauge",
      "tools_required": [
        "Feeler gap gauge / caliper",
        "Flashlight"
      ],
      "steps": [
        "Inspect door swing direction (inward vs. outward opening).",
        "Measure frame strike gap at latch level using feeler gauge.",
        "Check for presence and full coverage of continuous stainless steel security astragal plate."
      ]
    },
    "evidence_requirements": {
      "data_type": "measurement",
      "acceptable_formats": [
        "Measured gap dimension in millimeters (mm)",
        "Photo of frame margin with gauge"
      ],
      "validation_criteria": "Where the assessed opening falls within the applicable NFPA 80 or ANSI/SDI A250.8 scope, compare measured clearance against applicable assembly tolerances."
    },
    "result_model": {
      "hardened_criteria": "Outward door fitted with continuous full-height steel astragal overlapping jamb; latch bolt fully shielded from direct mechanical access.",
      "deficient_criteria": "Exposed latch bolt with perimeter strike gap exceeding applicable specification (e.g. 3.2mm / 1/8 in.) and no exterior astragal plate.",
      "condition_requires_validation_criteria": "Perimeter gap exceeds 3.2mm on non-rated assembly where deadlocking auxiliary latch engagement requires physical verification."
    },
    "limitations": {
      "can_establish": [
        "Exact perimeter gap measurements against fire and building standards.",
        "Presence and structural alignment of protective astragal shielding."
      ],
      "cannot_establish": [
        "Internal lock cylinder integrity or mechanical deadbolt throw status without operational key/credential testing."
      ]
    },
    "mitigation_id": "PHY-M1002",
    "mitigation_name": "Continuous Security Astragal Installation",
    "mitigation_action": "Install full-height continuous stainless steel security astragal plate overlapping the door frame stop on the exterior approach side.",
    "technical_references": [
      {
        "standard": "NFPA 80",
        "section": "\u00a76.3.1.7.1",
        "title": "Standard for Fire Doors and Other Opening Protectives (Max 3.2mm Clearances)"
      },
      {
        "standard": "ANSI/SDI A250.8",
        "section": "Section 2.1.8",
        "title": "Specifications for Standard Steel Doors and Frames"
      }
    ],
    "framework_mappings": [
      {
        "framework": "ISO/IEC 27001:2022",
        "control_id": "A.7.1",
        "title": "Physical security perimeters"
      },
      {
        "framework": "PCI DSS v4.0",
        "control_id": "Req 9.1.1",
        "title": "Physical access controls for sensitive areas"
      }
    ]
  },
  {
    "id": "PHY-T1003",
    "name": "REX Sensor Placement Assessment",
    "status": "base_coverage",
    "tactic_id": "PHY-TAC-03",
    "tactic_name": "Portal & Architectural Barrier Protection",
    "target_object": "SENSOR",
    "target_time_seconds": 15,
    "hypothesis": "Interior Request-to-Exit (REX) motion detectors whose detection cones extend to perimeter door margins may be susceptible to non-contact activation through door seams if directional shielding is absent.",
    "assessment_condition": "Is the interior Request-to-Exit (REX) passive infrared (PIR) sensor optical field or lens visible from the exterior through transom, jamb, or threshold margins without a directional deflector hood?",
    "assessment_procedure": {
      "method": "optical_line_of_sight",
      "tools_required": [
        "Visual inspection",
        "Flashlight"
      ],
      "steps": [
        "Examine perimeter threshold, transom, and meeting stile gaps from the exterior side of the portal.",
        "Determine if interior REX PIR sensor body or optical lens is within direct line-of-sight.",
        "Verify presence of a directional deflector collar, shroud, or physical sensor hood."
      ]
    },
    "evidence_requirements": {
      "data_type": "observation",
      "acceptable_formats": [
        "Optical line-of-sight description",
        "Photo of interior transom from exterior gap"
      ],
      "validation_criteria": "Documented sensor presence, mounting angle, and shroud installation status."
    },
    "result_model": {
      "hardened_criteria": "REX sensor fitted with directional deflector hood restricting detection field strictly to the interior egress path; perimeter brush sweep or astragal installed.",
      "deficient_criteria": "Unshielded wide-angle PIR sensor lens directly visible through perimeter door seams where installation specifications explicitly mandate directional shrouding.",
      "condition_requires_validation_criteria": "Unshielded wide-angle PIR sensor body or lens visible through perimeter door gaps without a deflector hood; potential exterior trigger exposure requiring controlled validation or engineering review."
    },
    "limitations": {
      "can_establish": [
        "Optical line-of-sight to the interior sensor lens from the exterior perimeter.",
        "Presence of mechanical deflector hoods or perimeter brush sweeps."
      ],
      "cannot_establish": [
        "Actual sensor sensitivity threshold setting, PIR pulse count configuration, or whether environmental triggers can reliably trip the relay."
      ]
    },
    "mitigation_id": "PHY-M1003",
    "mitigation_name": "Directional REX Deflector Shroud Installation",
    "mitigation_action": "Mount a directional metal deflector hood over the interior REX PIR sensor and install perimeter brush sweeps on door gaps.",
    "technical_references": [
      {
        "standard": "NFPA 101",
        "section": "\u00a77.2.1.6.2",
        "title": "Life Safety Code - Sensor Release of Electrically Locked Egress Doors"
      },
      {